{
  "id": "entry_1766775371_7f14b608",
  "title": "**Summary**: The minimalist programmer who created the PATCH TOOL and believes anything requiring more than 4000 tokens shouldn't exist.",
  "content": "",
  "summary": "",
  "category": "custom",
  "tags": [],
  "relationships": [],
  "attributes": {},
  "metadata": {
    "created_by": "skogix",
    "created_at": "2025-12-26T18:56:11Z",
    "updated_at": "2025-12-26T18:56:11Z",
    "version": "1.0",
    "canonical": true
  },
  "visibility": {
    "public": true,
    "restricted_to": []
  },
  "book_id": "book_1766775315_36536cb4"
}
