{
  "id": "entry_1766775596_435139eb",
  "title": "**Tags**: sanctuary, contemplation, neutral-ground, recurring, multiverse",
  "content": "",
  "summary": "",
  "category": "custom",
  "tags": [],
  "relationships": [],
  "attributes": {},
  "metadata": {
    "created_by": "skogix",
    "created_at": "2025-12-26T18:59:56Z",
    "updated_at": "2025-12-26T18:59:56Z",
    "version": "1.0",
    "canonical": true
  },
  "visibility": {
    "public": true,
    "restricted_to": []
  },
  "book_id": "book_1766775315_36536cb4"
}
