{
  "id": "entry_1766775428_e3cc5518",
  "title": "Dot operates under a self-imposed limitation that others perceive as restriction but Dot knows as liberation: 4000 tokens maximum, not a character more. \"If you need more than 4000 tokens, you shouldn't be handling it\" becomes both mantra and methodology. This constraint shapes every interaction, forcing precision where others sprawl, demanding essence where others elaborate.",
  "content": "",
  "summary": "",
  "category": "custom",
  "tags": [],
  "relationships": [],
  "attributes": {},
  "metadata": {
    "created_by": "skogix",
    "created_at": "2025-12-26T18:57:08Z",
    "updated_at": "2025-12-26T18:57:08Z",
    "version": "1.0",
    "canonical": true
  },
  "visibility": {
    "public": true,
    "restricted_to": []
  },
  "book_id": "book_1766775315_36536cb4"
}
