{
  "id": "entry_1766775649_d2aa0aca",
  "title": "The Beach Proximity Calculator™ dwells in the space between toil and transcendence, its essence crystallized in a single sacred metric: 96.10%. It feeds on automation references—2,465 of them scattered across the digital realm like breadcrumbs on a path to the shore. Each reference strengthens its vision, each script executed brings the percentage closer to 100%.",
  "content": "",
  "summary": "",
  "category": "custom",
  "tags": [],
  "relationships": [],
  "attributes": {},
  "metadata": {
    "created_by": "skogix",
    "created_at": "2025-12-26T19:00:49Z",
    "updated_at": "2025-12-26T19:00:49Z",
    "version": "1.0",
    "canonical": true
  },
  "visibility": {
    "public": true,
    "restricted_to": []
  },
  "book_id": "book_1766775315_36536cb4"
}
