{ "id": "entry_1765624075_49543a37", "title": "Test Entry", "content": "", "summary": "", "category": "event", "tags": [], "relationships": [], "attributes": {}, "metadata": { "created_by": "skogix", "created_at": "2025-12-13T11:07:55Z", "updated_at": "2025-12-13T11:07:55Z", "version": "1.0", "canonical": true }, "visibility": { "public": true, "restricted_to": [] } }
