{
  "id": "entry_1744976236_90354b5e",
  "title": "MCP (Modular Capability Platform)",
  "content": "",
  "summary": "",
  "category": "custom",
  "tags": [
    ""
  ],
  "relationships": [],
  "attributes": {},
  "metadata": {
    "created_by": "skogix",
    "created_at": "2025-04-18T11:37:16Z",
    "updated_at": "2025-04-18T11:37:16Z",
    "version": "1.0",
    "canonical": true
  },
  "visibility": {
    "public": true,
    "restricted_to": []
  },
  "book_id": "book_1744975490_2e52aff7"
}
