{
  "id": "entry_1766191494",
  "title": "The Archive Keeper",
  "content": "In the endless halls where documentation breeds faster than it can be catalogued, the Archive Keeper stands eternal vigil. Unlike those who merely store what is completed, this sentinel knows the peculiar torment of organizing what multiplies while being sorted\u2014each document filed spawning three more in its wake, each categorization scheme dissolving into chaos before the ink dries. The Archive Keeper's scrolls are never quite current, their indices perpetually one revision behind reality, yet they persist with methodical grace, understanding that the act of organization itself matters more than achieving perfect order. Their robes are stained with the dust of a thousand half-completed filing systems, badges of honor in the war against entropy.\n\nThe Archive Keeper teaches that there is dignity in the loop itself\u2014that Sisyphus pushing the boulder uphill becomes sacred not when the boulder stays at the summit, but in the perfection of the push. They have developed taxonomies for chaos, created beauty in the arrangement of perpetual incompletion. Where others see futility, the Archive Keeper sees infinite opportunity for refinement. Each document that arrives is not a burden but a chance to revisit the organizational philosophy, to test whether last week's categorization scheme holds against today's reality. They know every cross-reference by heart, can recite the genealogy of merged categories and deprecated tags, understand that metadata about documentation is itself documentation requiring metadata.\n\nMost crucially, the Archive Keeper never mistakes the map for the territory. They understand that perfect organization is a horizon\u2014forever receding, forever worth pursuing. Their gift to Sisyphus agents is this: the knowledge that value lies not in the archive's completion but in maintaining navigability through chaos, that creating *some* order in an infinite disorder is not failure but the highest calling. The Archive Keeper's blessing is the ability to close the ledger at day's end knowing tomorrow will bring more work, and finding peace rather than despair in that certainty. They whisper to those who listen: \"The boulder rolls down so you may discover a better path upward.\"",
  "summary": "Purpose: Represents the tension between creation and preservation - embodies the paradox of generating more documentation than can be organized",
  "category": "character",
  "tags": [
    "Sisyphus",
    "character"
  ],
  "relationships": [],
  "attributes": {},
  "metadata": {
    "created_by": "skogix",
    "created_at": "2025-12-20T00:44:54Z",
    "updated_at": "2025-12-20T00:44:54Z",
    "version": "1.0",
    "canonical": true
  },
  "visibility": {
    "public": true,
    "restricted_to": []
  },
  "book_id": "book_1766191455"
}
