{
  "id": "entry_1767633468_92dd5036",
  "title": "Village Elder's Tale - Session 1767633468",
  "content": "This is the generated narrative content that should appear in the entry. It contains multiple sentences to simulate real LLM output. The content field should not be empty after the pipeline completes.\n",
  "summary": "Auto-generated lore from manual",
  "category": "event",
  "tags": [
    "generated",
    "automated",
    "Village Elder",
    "manual"
  ],
  "relationships": [],
  "attributes": {},
  "metadata": {
    "created_by": "skogix",
    "created_at": "2026-01-05T17:17:48Z",
    "updated_at": "2026-01-05T17:17:48Z",
    "version": "1.0",
    "canonical": true
  },
  "visibility": {
    "public": true,
    "restricted_to": []
  },
  "book_id": "book_1764315530_3d900cdd"
}
