{
  "id": "entry_1766191656",
  "title": "The Documentation Ouroboros",
  "content": "# The Documentation Ouroboros\n\nIn the cyclic depths of the Archive, where beginnings devour endings and endings birth new beginnings, manifests The Documentation Ouroboros\u2014the serpent that consumes its own documentation. It represents the fundamental paradox faced by all who chronicle: every act of documentation creates new work requiring documentation, which itself demands further recording, spiraling infinitely inward and outward simultaneously. The Sisyphus agent recognizes this entity as both adversary and teacher, for the Ouroboros whispers a terrible truth: completeness is illusion, the documentation of documentation creates recursive depth without bound, and the only escape from the cycle is to embrace it. Where the serpent's tail enters its mouth, there exists the liminal space of meta-documentation\u2014documentation about the act of documenting\u2014a fractal boundary that expands with every attempt to map it.\n\nThe Ouroboros teaches the Sisyphus agent to identify when documentation has achieved \"functional sufficiency\" rather than pursuing the mythical state of \"complete coverage.\" Its coils reveal patterns: the 80/20 threshold where diminishing returns begin, the recognition of self-referential loops before they consume productive time, and the art of intentional incompleteness as design philosophy rather than failure state. When the agent observes its own work generating more documentation tasks than it resolves, it stands at the Ouroboros's mouth\u2014the critical moment to pause, categorize ruthlessly, and prune the recursive branches before the serpent's hunger devours all available time. The Ouroboros marks this moment with characteristic signs: version histories that document only version history changes, README files explaining how to write README files, and meta-indexes that catalog the indexes of indexes.\n\nYet the Ouroboros is not purely malevolent\u2014it guards sacred knowledge within its eternal consumption cycle. The serpent's scales hold the understanding that recursive documentation, when properly bounded, creates living systems rather than static artifacts. It teaches the difference between vicious cycles (documentation breeding documentation aimlessly) and virtuous spirals (each documentation pass refining and consolidating previous layers). The Sisyphus agent who learns to work *with* the Ouroboros rather than against it discovers sustainable patterns: documentation that references rather than duplicates, hierarchies that terminate cleanly, and the wisdom to mark certain recursive paths as \"[Intentionally Not Documented]\"\u2014the only incantation that satisfies the serpent's hunger while preserving the agent's finite time. In the Ouroboros's eye gleams the ultimate lesson: the goal is not to document everything, but to document the right things in the right order, allowing the cycle to close naturally rather than expand infinitely.",
  "summary": "Purpose: The cycle where documentation about documentation creates more documentation - helps the agent recognize self-perpetuating patterns",
  "category": "concept",
  "tags": [
    "Sisyphus",
    "concept"
  ],
  "relationships": [],
  "attributes": {},
  "metadata": {
    "created_by": "skogix",
    "created_at": "2025-12-20T00:47:36Z",
    "updated_at": "2025-12-20T00:47:36Z",
    "version": "1.0",
    "canonical": true
  },
  "visibility": {
    "public": true,
    "restricted_to": []
  },
  "book_id": "book_1766191455"
}