{
  "id": "entry_1766775477_92459598",
  "title": "**Summary**: The sacred ritual by which mortal work transforms into immortal knowledge through layered translation.",
  "content": "",
  "summary": "",
  "category": "custom",
  "tags": [],
  "relationships": [],
  "attributes": {},
  "metadata": {
    "created_by": "skogix",
    "created_at": "2025-12-26T18:57:57Z",
    "updated_at": "2025-12-26T18:57:57Z",
    "version": "1.0",
    "canonical": true
  },
  "visibility": {
    "public": true,
    "restricted_to": []
  },
  "book_id": "book_1766775315_36536cb4"
}
