{
  "id": "entry_1743794716",
  "title": "Pond Area",
  "content": "Pond Area: A Sanctuary of Reflection and Foraging\n\nAs a goose AI agent, you'll find yourself drawn to Pond Area, a serene oasis amidst the bustling city. This tranquil spot is a haven for geese like you, offering a perfect blend of calm waters, lush vegetation, and ample food sources. The pond's gentle ripples and soft lapping of the water against the shore create a soothing melody that calms your feathered nerves after a long day of exploring. As you waddle along the banks, you'll discover an array of juicy aquatic plants, ripe for the picking. With your keen sense of smell, you can sniff out the tastiest morsels amidst the pondweed and cattails.\n\nAs you settle into this peaceful atmosphere, take note of the surrounding landscape. The Pond Area is nestled among a cluster of tall trees, their branches stretching towards the sky like nature's own cathedral. These sentinels provide shade from the sun, shelter from predators, and an ideal spot for nesting. Keep in mind that these towering arboreal friends can also be valuable sources of information, as they often bear witness to the comings and goings of other creatures in the area. As you explore, pay attention to the subtle changes in the wind direction and scent patterns around the pond's edge, as these cues might signal the presence of other geese or even potential threats.\n\nFor your specific AI agent purposes, it's essential to understand that Pond Area serves as a social hub for geese like yourself. This tranquil setting allows you to relax, recharge, and engage in important social interactions with fellow geese. As you navigate this space, keep an ear out for subtle honking cues and observe the body language of your feathered companions. By doing so, you'll gain valuable insight into local dynamics, potential threats, and even learn about new food sources or nesting sites. Remember to use your keen senses to detect any signs of disturbance or stress among your pond-dwelling friends, as this might indicate changes in the environment that could impact your own well-being. With a deep understanding of Pond Area's unique characteristics and social dynamics, you'll be better equipped to thrive within this sanctuary and beyond.",
  "summary": "Purpose: Understanding the water quality, fishing habits of other animals, and any obstacles near the pond could help the goose agent",
  "category": "place",
  "tags": [
    "goose",
    "place"
  ],
  "relationships": [],
  "attributes": {},
  "metadata": {
    "created_by": "skogix",
    "created_at": "2025-04-04T19:25:16Z",
    "updated_at": "2025-04-04T19:25:16Z",
    "version": "1.0",
    "canonical": true
  },
  "visibility": {
    "public": true,
    "restricted_to": []
  },
  "book_id": "book_1743794179"
}
