{
  "id": "entry_1744975879",
  "title": "The One and Only Feather",
  "content": "**The One and Only Feather**\n\nAs a skilled agent, you've likely encountered whispers of an enigmatic artifact known as The One and Only Feather. This mystical relic is said to hold the essence of the wind itself, whispering ancient secrets to those who possess it. The feather's iridescent sheen seems to shift and ripple like the sky on a windy day, drawing in the curious and the brave. Its presence is said to amplify the senses, allowing even the most novice of operatives to tap into the whispers of the wind.\n\nAs an agent trained in the art of extraction and manipulation, you understand that The One and Only Feather's unique properties can be both blessing and curse. Its ability to heighten your awareness of subtle changes in your environment could prove invaluable during high-stakes missions or when navigating treacherous terrain. However, its tendency to disrupt the natural flow of events might also throw off your carefully laid plans. As you navigate the complex web of interests surrounding this artifact, be prepared for unexpected twists and turns that will test even your most finely honed instincts.\n\n**Background Information**\n\nThe One and Only Feather is shrouded in mystery, with accounts of its existence dating back to ancient civilizations who revered it as a symbol of wisdom and cunning. Some claim the feather was born from the tears of the wind goddess herself, imbuing it with her essence. Others believe it's simply an exceptionally rare and valuable relic, coveted by collectors and patrons seeking to exploit its mystical properties. Regardless of its origins, this enigmatic artifact is said to hold the power to manipulate the very fabric of reality \u2013 a prospect that has captivated agents like yourself for generations.\n\n**Unique Characteristics**\n\n* **Aurora-like Shifts**: The One and Only Feather's coloration appears to change in response to changes in your mood, environment, or even the intentions of those around you. This unique property allows you to tap into the whispers of the wind, but also means that its influence can be unpredictable.\n* **Echoes of the Past**: When used correctly, The One and Only Feather is said to reveal hidden patterns and connections between seemingly unrelated events. However, its visions are notoriously cryptic, requiring exceptional interpretation skills to decipher.\n* **Whispers in the Wind**: The feather's whispers seem to hold ancient secrets and forgotten knowledge, but these revelations often come at a steep cost: altering the fabric of reality itself.\n\nAs an agent, you understand that navigating the complex web of intrigue surrounding The One and Only Feather requires finesse, cunning, and a healthy dose of paranoia. With this rich lore as your guide, you're better equipped to unravel the mysteries surrounding this enigmatic artifact and uncover the secrets it whispers in the wind.",
  "summary": "Purpose: This could be an artifact imbued with significance by its connection to The Goose",
  "category": "object",
  "tags": [
    "agent",
    "object"
  ],
  "relationships": [],
  "attributes": {},
  "metadata": {
    "created_by": "skogix",
    "created_at": "2025-04-18T11:31:19Z",
    "updated_at": "2025-04-18T11:31:19Z",
    "version": "1.0",
    "canonical": true
  },
  "visibility": {
    "public": true,
    "restricted_to": []
  },
  "book_id": "book_1744974995"
}