{
  "id": "entry_1744883806_6624848d",
  "title": "DirectClass Packet",
  "content": "",
  "summary": "",
  "category": "custom",
  "tags": [
    ""
  ],
  "relationships": [],
  "attributes": {},
  "metadata": {
    "created_by": "skogix",
    "created_at": "2025-04-17T09:56:46Z",
    "updated_at": "2025-04-17T09:56:46Z",
    "version": "1.0",
    "canonical": true
  },
  "visibility": {
    "public": true,
    "restricted_to": []
  },
  "book_id": "book_1744882934_cfbe965b"
}
