{
  "id": "entry_1749591101_239da660",
  "title": "place",
  "content": "",
  "summary": "",
  "category": "place",
  "tags": [
    ""
  ],
  "relationships": [],
  "attributes": {},
  "metadata": {
    "created_by": "skogix",
    "created_at": "2025-06-10T21:31:41Z",
    "updated_at": "2025-06-10T21:31:41Z",
    "version": "1.0",
    "canonical": true
  },
  "visibility": {
    "public": true,
    "restricted_to": []
  },
  "book_id": "book_1749591048_c6ba1544"
}
