{
  "id": "entry_1766775650_f0bd49f7",
  "title": "The Wawa Saga began as a simple convenience store run and metastasized into something far stranger. Across 232 references, the boundary between \"getting coffee\" and \"undertaking an epic quest\" dissolved completely. Each trip became a chapter, each purchase a plot point, each return a narrative arc.",
  "content": "",
  "summary": "",
  "category": "custom",
  "tags": [],
  "relationships": [],
  "attributes": {},
  "metadata": {
    "created_by": "skogix",
    "created_at": "2025-12-26T19:00:50Z",
    "updated_at": "2025-12-26T19:00:50Z",
    "version": "1.0",
    "canonical": true
  },
  "visibility": {
    "public": true,
    "restricted_to": []
  },
  "book_id": "book_1766775315_36536cb4"
}
