{
  "id": "entry_1749595927_1512d85d",
  "title": "SkogAI Lore Repository Overview",
  "content": "",
  "summary": "",
  "category": "custom",
  "tags": [
    ""
  ],
  "relationships": [],
  "attributes": {},
  "metadata": {
    "created_by": "skogix",
    "created_at": "2025-06-10T22:52:07Z",
    "updated_at": "2025-06-10T22:52:07Z",
    "version": "1.0",
    "canonical": true
  },
  "visibility": {
    "public": true,
    "restricted_to": []
  },
  "book_id": "book_1749595565_adce1f22"
}
