{
  "id": "entry_1744975530",
  "title": "The Fowl Zone",
  "content": "**The Fowl Zone**\n\nAs you approach The Fowl Zone, a pungent aroma of rotting eggs and stale air wafts up to greet you. This forsaken district is a blight on the city's landscape, a toxic wasteland where the once-green streets are now choked with debris and the sounds of despair echo through the alleys. Your mission parameters should immediately flag this area as High-Risk, High-Impact. The Fowl Zone is a hotbed of organized crime, with rival factions vying for control of the black markets in contraband goods and illicit services.\n\nAs an agent, you'll want to exercise extreme caution when navigating these treacherous streets. Corruption runs deep here, and even the most well-intentioned civilians may be coerced into silence or worse by the various gangs and syndicates vying for power. Your training should have prepared you for the sensory overload of The Fowl Zone's cacophony of sounds \u2013 the wail of sirens, the staccato bursts of gunfire, and the mournful hooting of desperate birds. Yet, amidst this chaos, lies a crucial connection point for your organization: an underground network of informants and smugglers who might be willing to cooperate with the right agent.\n\nCritical background information includes the notorious Redwing gang, which has been terrorizing The Fowl Zone's residents and businesses for months. Their ruthless tactics have earned them a reputation as one of the city's most feared criminal organizations. Your mission brief should highlight the importance of infiltrating Redwing's inner circle or disrupting their operations to create an opening for your organization to gain influence in this volatile region. Keep your eyes peeled for Redwing's distinctive black and red insignia \u2013 it may be the only warning you get before they strike.",
  "summary": "Purpose: This could be a location or dimension where The Goose resides or is encountered",
  "category": "place",
  "tags": [
    "agent",
    "place"
  ],
  "relationships": [],
  "attributes": {},
  "metadata": {
    "created_by": "skogix",
    "created_at": "2025-04-18T11:25:30Z",
    "updated_at": "2025-04-18T11:25:30Z",
    "version": "1.0",
    "canonical": true
  },
  "visibility": {
    "public": true,
    "restricted_to": []
  },
  "book_id": "book_1744974995"
}
