{
  "id": "entry_1766775538_7da60137",
  "title": "**Summary**: The five-stage alchemical process that transmutes code commits into narrative lore entries.",
  "content": "",
  "summary": "",
  "category": "custom",
  "tags": [],
  "relationships": [],
  "attributes": {},
  "metadata": {
    "created_by": "skogix",
    "created_at": "2025-12-26T18:58:58Z",
    "updated_at": "2025-12-26T18:58:58Z",
    "version": "1.0",
    "canonical": true
  },
  "visibility": {
    "public": true,
    "restricted_to": []
  },
  "book_id": "book_1766775315_36536cb4"
}
